{
  "schema_version": 1,
  "name": "EVO MicroPython Firmware",
  "version": "v1.1.0-beta.4",
  "channel": "beta",
  "repository": "ljk1331ljk/EVO-micropython",
  "commit": "2a34e08ab81f81a0073870dd986f5eefd22ed4f5",
  "release_tag": "v1.1.0-beta.4",
  "prerelease": true,
  "generated_at": "2026-06-01T03:34:05Z",
  "devices": [
    {
      "id": "EVOX1E",
      "board": "EVOX1E",
      "variant": "SPIRAM_OCT",
      "product": "EVOX1E",
      "port": "esp32",
      "chip": "esp32",
      "capabilities": {
        "multiple_programs": {
          "supported": true,
          "root": "/programs",
          "main_file": "main.py"
        }
      },
      "assets": {
        "bootloader": {
          "file": "EVOX1E-SPIRAM_OCT-20260601-v1.1.0-beta.4.bootloader.bin",
          "offset": "0x0",
          "sha256": "235dc20331f0aea6fda20dbd2207abcbad6c2011c9f589a01e68931a9d4ddf4f",
          "size": 19232,
          "url": "https://ljk1331ljk.github.io/EVO-micropython/firmware/v1.1.0-beta.4/evox1e/bootloader.bin"
        },
        "partition_table": {
          "file": "EVOX1E-SPIRAM_OCT-20260601-v1.1.0-beta.4.partition-table.bin",
          "offset": "0x8000",
          "sha256": "520c18ca0bda73aed288d427d260ab051d71219f605707350e6c42401f4836fc",
          "size": 3072,
          "url": "https://ljk1331ljk.github.io/EVO-micropython/firmware/v1.1.0-beta.4/evox1e/partition-table.bin"
        },
        "application": {
          "file": "EVOX1E-SPIRAM_OCT-20260601-v1.1.0-beta.4.micropython.bin",
          "offset": "0x10000",
          "sha256": "2281ab6c84e670709ed43b13cc334f317f952b57e7cb0ef08591e3bf586898bf",
          "size": 1878400,
          "url": "https://ljk1331ljk.github.io/EVO-micropython/firmware/v1.1.0-beta.4/evox1e/micropython.bin"
        }
      },
      "flash_sequence": [
        {
          "path": "bootloader.bin",
          "address": "0x0",
          "description": "Bootloader"
        },
        {
          "path": "partition-table.bin",
          "address": "0x8000",
          "description": "Partition table"
        },
        {
          "path": "micropython.bin",
          "address": "0x10000",
          "description": "MicroPython"
        }
      ]
    },
    {
      "id": "EVOX1P",
      "board": "EVOX1P",
      "variant": "SPIRAM_OCT",
      "product": "EVOX1P",
      "port": "esp32",
      "chip": "esp32",
      "capabilities": {
        "multiple_programs": {
          "supported": true,
          "root": "/programs",
          "main_file": "main.py"
        }
      },
      "assets": {
        "bootloader": {
          "file": "EVOX1P-SPIRAM_OCT-20260601-v1.1.0-beta.4.bootloader.bin",
          "offset": "0x0",
          "sha256": "c9b23250415fe1084cb03adb02093abe1a995e1627e2e2284c47fc8f8d057510",
          "size": 19232,
          "url": "https://ljk1331ljk.github.io/EVO-micropython/firmware/v1.1.0-beta.4/evox1p/bootloader.bin"
        },
        "partition_table": {
          "file": "EVOX1P-SPIRAM_OCT-20260601-v1.1.0-beta.4.partition-table.bin",
          "offset": "0x8000",
          "sha256": "520c18ca0bda73aed288d427d260ab051d71219f605707350e6c42401f4836fc",
          "size": 3072,
          "url": "https://ljk1331ljk.github.io/EVO-micropython/firmware/v1.1.0-beta.4/evox1p/partition-table.bin"
        },
        "application": {
          "file": "EVOX1P-SPIRAM_OCT-20260601-v1.1.0-beta.4.micropython.bin",
          "offset": "0x10000",
          "sha256": "be707f148eba413be74b98b12818bddf77608866e16d3b23d56fa08613afcbbc",
          "size": 1880672,
          "url": "https://ljk1331ljk.github.io/EVO-micropython/firmware/v1.1.0-beta.4/evox1p/micropython.bin"
        }
      },
      "flash_sequence": [
        {
          "path": "bootloader.bin",
          "address": "0x0",
          "description": "Bootloader"
        },
        {
          "path": "partition-table.bin",
          "address": "0x8000",
          "description": "Partition table"
        },
        {
          "path": "micropython.bin",
          "address": "0x10000",
          "description": "MicroPython"
        }
      ]
    }
  ],
  "base_url": "https://ljk1331ljk.github.io/EVO-micropython/firmware/v1.1.0-beta.4"
}
