{
  "schema_version": 1,
  "name": "EVO MicroPython Firmware",
  "version": "v1.2.0",
  "channel": "stable",
  "repository": "ljk1331ljk/EVO-micropython",
  "commit": "48030582e4757e4b0e1f59244a6afb494f9a31c5",
  "release_tag": "v1.2.0",
  "prerelease": false,
  "generated_at": "2026-07-06T04:38:02Z",
  "devices": [
    {
      "id": "EVOX1E",
      "board": "EVOX1E",
      "variant": "SPIRAM_OCT",
      "product": "EVOX1E",
      "port": "esp32",
      "chip": "esp32",
      "capabilities": {
        "multiple_programs": {
          "supported": true,
          "root": "/programs",
          "main_file": "main.py"
        }
      },
      "assets": {
        "bootloader": {
          "file": "EVOX1E-SPIRAM_OCT-20260706-v1.2.0.bootloader.bin",
          "offset": "0x0",
          "sha256": "6822fcfcac4b10fe709bf994c7eb44765998718fdf44d1a24de9709591aebdee",
          "size": 19232,
          "url": "https://ljk1331ljk.github.io/EVO-micropython/firmware/v1.2.0/evox1e/bootloader.bin"
        },
        "partition_table": {
          "file": "EVOX1E-SPIRAM_OCT-20260706-v1.2.0.partition-table.bin",
          "offset": "0x8000",
          "sha256": "520c18ca0bda73aed288d427d260ab051d71219f605707350e6c42401f4836fc",
          "size": 3072,
          "url": "https://ljk1331ljk.github.io/EVO-micropython/firmware/v1.2.0/evox1e/partition-table.bin"
        },
        "application": {
          "file": "EVOX1E-SPIRAM_OCT-20260706-v1.2.0.micropython.bin",
          "offset": "0x10000",
          "sha256": "a57796f4fbaf05da6edfb16170b26c273573aafb869d91a98680c52f3da7e011",
          "size": 1888352,
          "url": "https://ljk1331ljk.github.io/EVO-micropython/firmware/v1.2.0/evox1e/micropython.bin"
        }
      },
      "flash_sequence": [
        {
          "path": "bootloader.bin",
          "address": "0x0",
          "description": "Bootloader"
        },
        {
          "path": "partition-table.bin",
          "address": "0x8000",
          "description": "Partition table"
        },
        {
          "path": "micropython.bin",
          "address": "0x10000",
          "description": "MicroPython"
        }
      ]
    },
    {
      "id": "EVOX1P",
      "board": "EVOX1P",
      "variant": "SPIRAM_OCT",
      "product": "EVOX1P",
      "port": "esp32",
      "chip": "esp32",
      "capabilities": {
        "multiple_programs": {
          "supported": true,
          "root": "/programs",
          "main_file": "main.py"
        }
      },
      "assets": {
        "bootloader": {
          "file": "EVOX1P-SPIRAM_OCT-20260706-v1.2.0.bootloader.bin",
          "offset": "0x0",
          "sha256": "019ab91a68daf8d69613915ff3385f2fe0f349e3f4b4575a28bef230a31bc68d",
          "size": 19232,
          "url": "https://ljk1331ljk.github.io/EVO-micropython/firmware/v1.2.0/evox1p/bootloader.bin"
        },
        "partition_table": {
          "file": "EVOX1P-SPIRAM_OCT-20260706-v1.2.0.partition-table.bin",
          "offset": "0x8000",
          "sha256": "520c18ca0bda73aed288d427d260ab051d71219f605707350e6c42401f4836fc",
          "size": 3072,
          "url": "https://ljk1331ljk.github.io/EVO-micropython/firmware/v1.2.0/evox1p/partition-table.bin"
        },
        "application": {
          "file": "EVOX1P-SPIRAM_OCT-20260706-v1.2.0.micropython.bin",
          "offset": "0x10000",
          "sha256": "0cf38500f8832a6bb51ac3da1ecaea0ee2eab8774fe06240bfdd3bb46e96440d",
          "size": 1891296,
          "url": "https://ljk1331ljk.github.io/EVO-micropython/firmware/v1.2.0/evox1p/micropython.bin"
        }
      },
      "flash_sequence": [
        {
          "path": "bootloader.bin",
          "address": "0x0",
          "description": "Bootloader"
        },
        {
          "path": "partition-table.bin",
          "address": "0x8000",
          "description": "Partition table"
        },
        {
          "path": "micropython.bin",
          "address": "0x10000",
          "description": "MicroPython"
        }
      ]
    }
  ],
  "base_url": "https://ljk1331ljk.github.io/EVO-micropython/firmware/v1.2.0"
}
